{
  "bundle_id": "00000000-0000-4000-8000-000000000002",
  "version": "0.2.0",
  "created_at": "2026-01-15T12:00:00.000Z",
  "items": [
    {
      "item_id": "item-001",
      "sequence": 0,
      "content_type": "guardspine/artifact_version",
      "content": {
        "artifact_id": "doc-123",
        "version": "1.0.0",
        "checksum": "sha256:abc123"
      },
      "content_hash": "sha256:1111111111111111111111111111111111111111111111111111111111111111"
    },
    {
      "item_id": "item-002",
      "sequence": 1,
      "content_type": "guardspine/diff",
      "content": {
        "from_version": "1.0.0",
        "to_version": "1.0.1",
        "changes": [{"type": "modify", "path": "/section/1"}]
      },
      "content_hash": "sha256:2222222222222222222222222222222222222222222222222222222222222222"
    },
    {
      "item_id": "item-003",
      "sequence": 2,
      "content_type": "guardspine/policy_evaluation",
      "content": {
        "policy_pack": "nomotic-core",
        "result": "pass",
        "violations": []
      },
      "content_hash": "sha256:3333333333333333333333333333333333333333333333333333333333333333"
    },
    {
      "item_id": "item-004",
      "sequence": 3,
      "content_type": "guardspine/approval",
      "content": {
        "decision": "approved",
        "approver": "manager@example.com"
      },
      "content_hash": "sha256:4444444444444444444444444444444444444444444444444444444444444444"
    },
    {
      "item_id": "item-005",
      "sequence": 4,
      "content_type": "guardspine/audit_event",
      "content": {
        "event_type": "bundle_created",
        "timestamp": "2026-01-15T12:00:00.000Z"
      },
      "content_hash": "sha256:5555555555555555555555555555555555555555555555555555555555555555"
    }
  ],
  "immutability_proof": {
    "hash_chain": [
      {
        "sequence": 0,
        "item_id": "item-001",
        "content_type": "guardspine/artifact_version",
        "content_hash": "sha256:1111111111111111111111111111111111111111111111111111111111111111",
        "previous_hash": "genesis",
        "chain_hash": "sha256:aaaaaaaaaaaaaaaaaaaaaaaaaaaaaaaaaaaaaaaaaaaaaaaaaaaaaaaaaaaaaaaa"
      },
      {
        "sequence": 1,
        "item_id": "item-002",
        "content_type": "guardspine/diff",
        "content_hash": "sha256:2222222222222222222222222222222222222222222222222222222222222222",
        "previous_hash": "sha256:aaaaaaaaaaaaaaaaaaaaaaaaaaaaaaaaaaaaaaaaaaaaaaaaaaaaaaaaaaaaaaaa",
        "chain_hash": "sha256:bbbbbbbbbbbbbbbbbbbbbbbbbbbbbbbbbbbbbbbbbbbbbbbbbbbbbbbbbbbbbbbb"
      },
      {
        "sequence": 2,
        "item_id": "item-003",
        "content_type": "guardspine/policy_evaluation",
        "content_hash": "sha256:3333333333333333333333333333333333333333333333333333333333333333",
        "previous_hash": "sha256:bbbbbbbbbbbbbbbbbbbbbbbbbbbbbbbbbbbbbbbbbbbbbbbbbbbbbbbbbbbbbbbb",
        "chain_hash": "sha256:cccccccccccccccccccccccccccccccccccccccccccccccccccccccccccccccc"
      },
      {
        "sequence": 3,
        "item_id": "item-004",
        "content_type": "guardspine/approval",
        "content_hash": "sha256:4444444444444444444444444444444444444444444444444444444444444444",
        "previous_hash": "sha256:cccccccccccccccccccccccccccccccccccccccccccccccccccccccccccccccc",
        "chain_hash": "sha256:dddddddddddddddddddddddddddddddddddddddddddddddddddddddddddddddd"
      },
      {
        "sequence": 4,
        "item_id": "item-005",
        "content_type": "guardspine/audit_event",
        "content_hash": "sha256:5555555555555555555555555555555555555555555555555555555555555555",
        "previous_hash": "sha256:dddddddddddddddddddddddddddddddddddddddddddddddddddddddddddddddd",
        "chain_hash": "sha256:eeeeeeeeeeeeeeeeeeeeeeeeeeeeeeeeeeeeeeeeeeeeeeeeeeeeeeeeeeeeeeee"
      }
    ],
    "root_hash": "sha256:ffffffffffffffffffffffffffffffffffffffffffffffffffffffffffffffff"
  },
  "metadata": {
    "retention": {
      "policy": "regulatory",
      "retention_days": 2555
    }
  }
}
