{
  "bundle_id": "00000000-0000-4000-8000-000000006600",
  "version": "0.2.0",
  "created_at": "2026-06-12T00:00:00Z",
  "immutability_proof": {
    "hash_chain": [
      {
        "sequence": 0,
        "item_id": "adv-null-content",
        "content_type": "guardspine/adversarial/null",
        "content_hash": "sha256:74234e98afe7498fb5daf1f36ac2d78acc339464f950703b8c019892f982b90b",
        "previous_hash": "genesis",
        "chain_hash": "sha256:997cae4493270766448ba38e0fc3ba76f0ce39e7452f76fcf675a01925631e24"
      },
      {
        "sequence": 1,
        "item_id": "adv-safe-int",
        "content_type": "guardspine/adversarial/safe-int",
        "content_hash": "sha256:64320c252cc1e78a180d51f9ac73a9d6db9800f205cd2d6d5980bfd2da96383f",
        "previous_hash": "sha256:997cae4493270766448ba38e0fc3ba76f0ce39e7452f76fcf675a01925631e24",
        "chain_hash": "sha256:01579c827c8e8bf1b7e49b9106a62a5e6ba72cebbd0ca6df3f58d059f22510dc"
      },
      {
        "sequence": 2,
        "item_id": "adv-float-exponent",
        "content_type": "guardspine/adversarial/float",
        "content_hash": "sha256:b00f6aefd44a07cefc0befa550f958d8f29b3433d81496569ea98d93da280050",
        "previous_hash": "sha256:01579c827c8e8bf1b7e49b9106a62a5e6ba72cebbd0ca6df3f58d059f22510dc",
        "chain_hash": "sha256:65b8fc4d186b7d297413e9da889ff440894a2956a17b94395395330e6952066b"
      },
      {
        "sequence": 3,
        "item_id": "adv-non-ascii-key",
        "content_type": "guardspine/adversarial/unicode-key",
        "content_hash": "sha256:e5a0ebb184b1aa6953b5c1a11538b1b4371ae4a55d9723f96e637d91960e5b75",
        "previous_hash": "sha256:65b8fc4d186b7d297413e9da889ff440894a2956a17b94395395330e6952066b",
        "chain_hash": "sha256:6457f1d92cd11f3c310beeef0bf90909cd80966ad489440cd710c7e692ca36be"
      }
    ],
    "root_hash": "sha256:cfd143a7456c721e2fdd67e3295f86f61ddb3833f7911d52495f6fdb9e7ae779"
  },
  "items": [
    {
      "item_id": "adv-null-content",
      "content_type": "guardspine/adversarial/null",
      "content": null,
      "content_hash": "sha256:74234e98afe7498fb5daf1f36ac2d78acc339464f950703b8c019892f982b90b",
      "sequence": 0
    },
    {
      "item_id": "adv-safe-int",
      "content_type": "guardspine/adversarial/safe-int",
      "content": {
        "max_safe": 9007199254740991
      },
      "content_hash": "sha256:64320c252cc1e78a180d51f9ac73a9d6db9800f205cd2d6d5980bfd2da96383f",
      "sequence": 1
    },
    {
      "item_id": "adv-float-exponent",
      "content_type": "guardspine/adversarial/float",
      "content": {
        "tiny": 1e-07
      },
      "content_hash": "sha256:b00f6aefd44a07cefc0befa550f958d8f29b3433d81496569ea98d93da280050",
      "sequence": 2
    },
    {
      "item_id": "adv-non-ascii-key",
      "content_type": "guardspine/adversarial/unicode-key",
      "content": {
        "a": 0,
        "\ue000": 1,
        "\ud800\udc00": 2
      },
      "content_hash": "sha256:e5a0ebb184b1aa6953b5c1a11538b1b4371ae4a55d9723f96e637d91960e5b75",
      "sequence": 3
    }
  ]
}
