{
  "bundle_id": "00000000-0000-4000-8000-000000000001",
  "version": "0.2.0",
  "created_at": "2026-01-15T10:30:00.000Z",
  "items": [
    {
      "item_id": "item-001",
      "sequence": 0,
      "content_type": "guardspine/audit_event",
      "content": {
        "event_type": "test_event",
        "message": "Golden vector minimal bundle test"
      },
      "content_hash": "sha256:e3b0c44298fc1c149afbf4c8996fb92427ae41e4649b934ca495991b7852b855"
    }
  ],
  "immutability_proof": {
    "hash_chain": [
      {
        "sequence": 0,
        "item_id": "item-001",
        "content_type": "guardspine/audit_event",
        "content_hash": "sha256:e3b0c44298fc1c149afbf4c8996fb92427ae41e4649b934ca495991b7852b855",
        "previous_hash": "genesis",
        "chain_hash": "sha256:a1b2c3d4e5f6789012345678901234567890123456789012345678901234abcd"
      }
    ],
    "root_hash": "sha256:a1b2c3d4e5f6789012345678901234567890123456789012345678901234abcd"
  },
  "metadata": {
    "retention": {
      "policy": "standard",
      "retention_days": 365
    }
  }
}
